{
  "schema_version": 1,
  "registry_id": "PROVIDER_POLICY_REGISTRY_V1",
  "policy": {
    "routing_order": ["DETERMINISTIC", "LOCAL", "FREE_ONLINE", "PREMIUM"],
    "fail_closed": true,
    "unverified_production_eligible": false,
    "quality_and_risk_override_cost": true
  },
  "providers": [
    {"provider_id":"OLLAMA_LOCAL","state":"AVAILABLE","configured":true,"verified_for_production":true,"free_tier_available":true,"estimated_cost_class":"LOCAL_COMPUTE","quota_type":"LOCAL_RESOURCE","quota_remaining":null,"privacy_class":"LOCAL_ONLY","last_health_check":null,"notes":"Existing local runtime; health remains runtime-specific."},
    {"provider_id":"CLAUDE","state":"OFFLINE","configured":false,"verified_for_production":false,"free_tier_available":false,"estimated_cost_class":"PREMIUM","quota_type":"PROVIDER_QUOTA","quota_remaining":null,"privacy_class":"REMOTE_REDACTED_CONTEXT_ONLY","last_health_check":null,"notes":"Structural premium provider; no live adapter configured."},
    {"provider_id":"CODEX_OPENAI","state":"OFFLINE","configured":false,"verified_for_production":false,"free_tier_available":false,"estimated_cost_class":"PREMIUM","quota_type":"PROVIDER_QUOTA","quota_remaining":null,"privacy_class":"REMOTE_REDACTED_CONTEXT_ONLY","last_health_check":null,"notes":"Structural premium provider; no live adapter configured."},
    {"provider_id":"GEMINI","state":"UNKNOWN","configured":false,"verified_for_production":false,"free_tier_available":true,"estimated_cost_class":"FREE_TIER_CANDIDATE","quota_type":"UNKNOWN","quota_remaining":null,"privacy_class":"REMOTE_REDACTED_CONTEXT_ONLY","last_health_check":null,"notes":"Evaluation-only until configured, health-checked and benchmarked."},
    {"provider_id":"GROQ","state":"UNKNOWN","configured":false,"verified_for_production":false,"free_tier_available":true,"estimated_cost_class":"FREE_TIER_CANDIDATE","quota_type":"UNKNOWN","quota_remaining":null,"privacy_class":"REMOTE_REDACTED_CONTEXT_ONLY","last_health_check":null,"notes":"Evaluation-only until configured, health-checked and benchmarked."},
    {"provider_id":"OPENROUTER","state":"UNKNOWN","configured":false,"verified_for_production":false,"free_tier_available":true,"estimated_cost_class":"FREE_TIER_CANDIDATE","quota_type":"UNKNOWN","quota_remaining":null,"privacy_class":"REMOTE_REDACTED_CONTEXT_ONLY","last_health_check":null,"notes":"Evaluation-only until configured, health-checked and benchmarked."},
    {"provider_id":"HUGGING_FACE","state":"UNKNOWN","configured":false,"verified_for_production":false,"free_tier_available":true,"estimated_cost_class":"FREE_TIER_CANDIDATE","quota_type":"UNKNOWN","quota_remaining":null,"privacy_class":"REMOTE_REDACTED_CONTEXT_ONLY","last_health_check":null,"notes":"Evaluation-only until configured, health-checked and benchmarked."}
  ],
  "models": [
    {"provider_id":"OLLAMA_LOCAL","model_id":"ministral-3:3b","model_family":"MINISTRAL","state":"AVAILABLE","configured":true,"verified_for_production":true,"free_tier_available":true,"estimated_cost_class":"LOCAL_COMPUTE","quota_type":"LOCAL_RESOURCE","quota_remaining":null,"context_window":null,"supports_tools":true,"supports_images":false,"supports_structured_output":true,"supports_code":true,"supports_long_context":null,"supports_reasoning":true,"privacy_class":"LOCAL_ONLY","allowed_task_types":["CODE","BACKFILL","DOCUMENTATION","MONITORING","MAINTENANCE"],"forbidden_task_types":["DEPLOY","MT5_RUN","APPROVAL","MARKET","RESEARCH"],"preferred_roles":["LOCAL_GENERALIST"],"fallback_priority":10,"last_health_check":null,"last_benchmark":"agent_capability_registry_v1.json","benchmark_score":null,"notes":"Capabilities mirror the existing local strong agent registry; unknown fields stay null."},
    {"provider_id":"CLAUDE","model_id":"CLAUDE_UNSPECIFIED","model_family":"CLAUDE","state":"OFFLINE","configured":false,"verified_for_production":false,"free_tier_available":false,"estimated_cost_class":"PREMIUM","quota_type":"PROVIDER_QUOTA","quota_remaining":null,"context_window":null,"supports_tools":null,"supports_images":null,"supports_structured_output":null,"supports_code":true,"supports_long_context":null,"supports_reasoning":true,"privacy_class":"REMOTE_REDACTED_CONTEXT_ONLY","allowed_task_types":["RESEARCH","CODE","DOCUMENTATION"],"forbidden_task_types":["DEPLOY","MT5_RUN","MARKET"],"preferred_roles":["SCIENTIFIC_RESEARCHER"],"fallback_priority":90,"last_health_check":null,"last_benchmark":null,"benchmark_score":null,"notes":"Premium policy candidate only; unusable until verified and configured."},
    {"provider_id":"CODEX_OPENAI","model_id":"CODEX_UNSPECIFIED","model_family":"CODEX_GPT","state":"OFFLINE","configured":false,"verified_for_production":false,"free_tier_available":false,"estimated_cost_class":"PREMIUM","quota_type":"PROVIDER_QUOTA","quota_remaining":null,"context_window":null,"supports_tools":true,"supports_images":null,"supports_structured_output":null,"supports_code":true,"supports_long_context":null,"supports_reasoning":true,"privacy_class":"REMOTE_REDACTED_CONTEXT_ONLY","allowed_task_types":["CODE","DEPLOY"],"forbidden_task_types":["MT5_RUN","MARKET","APPROVAL"],"preferred_roles":["CODE_SPECIALIST"],"fallback_priority":90,"last_health_check":null,"last_benchmark":null,"benchmark_score":null,"notes":"Premium policy candidate only; unusable until verified and configured."},
    {"provider_id":"GEMINI","model_id":"GEMINI_UNSPECIFIED","model_family":"GEMINI","state":"UNKNOWN","configured":false,"verified_for_production":false,"free_tier_available":true,"estimated_cost_class":"FREE_TIER_CANDIDATE","quota_type":"UNKNOWN","quota_remaining":null,"context_window":null,"supports_tools":null,"supports_images":null,"supports_structured_output":null,"supports_code":null,"supports_long_context":null,"supports_reasoning":null,"privacy_class":"REMOTE_REDACTED_CONTEXT_ONLY","allowed_task_types":["DOCUMENTATION","MONITORING","CODE"],"forbidden_task_types":["DEPLOY","MT5_RUN","APPROVAL","MARKET"],"preferred_roles":["FREE_ONLINE_CANDIDATE"],"fallback_priority":30,"last_health_check":null,"last_benchmark":null,"benchmark_score":null,"notes":"Evaluation-only; model and capabilities intentionally unspecified."},
    {"provider_id":"GROQ","model_id":"QWEN_UNSPECIFIED","model_family":"QWEN","state":"UNKNOWN","configured":false,"verified_for_production":false,"free_tier_available":true,"estimated_cost_class":"FREE_TIER_CANDIDATE","quota_type":"UNKNOWN","quota_remaining":null,"context_window":null,"supports_tools":null,"supports_images":null,"supports_structured_output":null,"supports_code":null,"supports_long_context":null,"supports_reasoning":null,"privacy_class":"REMOTE_REDACTED_CONTEXT_ONLY","allowed_task_types":["DOCUMENTATION","MONITORING","CODE"],"forbidden_task_types":["DEPLOY","MT5_RUN","APPROVAL","MARKET"],"preferred_roles":["FREE_ONLINE_CANDIDATE"],"fallback_priority":20,"last_health_check":null,"last_benchmark":null,"benchmark_score":null,"notes":"Evaluation-only; model and capabilities intentionally unspecified."},
    {"provider_id":"OPENROUTER","model_id":"LLAMA_UNSPECIFIED","model_family":"LLAMA","state":"UNKNOWN","configured":false,"verified_for_production":false,"free_tier_available":true,"estimated_cost_class":"FREE_TIER_CANDIDATE","quota_type":"UNKNOWN","quota_remaining":null,"context_window":null,"supports_tools":null,"supports_images":null,"supports_structured_output":null,"supports_code":null,"supports_long_context":null,"supports_reasoning":null,"privacy_class":"REMOTE_REDACTED_CONTEXT_ONLY","allowed_task_types":["DOCUMENTATION","MONITORING","CODE"],"forbidden_task_types":["DEPLOY","MT5_RUN","APPROVAL","MARKET"],"preferred_roles":["FREE_ONLINE_CANDIDATE"],"fallback_priority":25,"last_health_check":null,"last_benchmark":null,"benchmark_score":null,"notes":"Evaluation-only; model and capabilities intentionally unspecified."},
    {"provider_id":"HUGGING_FACE","model_id":"GPT_OSS_UNSPECIFIED","model_family":"GPT_OSS","state":"UNKNOWN","configured":false,"verified_for_production":false,"free_tier_available":true,"estimated_cost_class":"FREE_TIER_CANDIDATE","quota_type":"UNKNOWN","quota_remaining":null,"context_window":null,"supports_tools":null,"supports_images":null,"supports_structured_output":null,"supports_code":null,"supports_long_context":null,"supports_reasoning":null,"privacy_class":"REMOTE_REDACTED_CONTEXT_ONLY","allowed_task_types":["DOCUMENTATION","MONITORING","CODE"],"forbidden_task_types":["DEPLOY","MT5_RUN","APPROVAL","MARKET"],"preferred_roles":["FREE_ONLINE_CANDIDATE"],"fallback_priority":35,"last_health_check":null,"last_benchmark":null,"benchmark_score":null,"notes":"Evaluation-only; model and capabilities intentionally unspecified."}
  ]
}
